{"action":"research.object.create","command_id":"cmd-phase2e-research-software-create-0002","payload":{"data":{"content":"Acceptance-only draft. This Research Software object will be rolled back after replay verification.","excerpt":"Temporary draft used to verify the bounded ChatGPT Research command gateway.","language":"en","programming_languages":[],"status":"draft","title":"Phase 2E Research Software acceptance fixture"},"evidence_confirmed":true,"evidence_reference":"acceptance:phase2e:research-software:create","kind":"software"},"requested_by":"chatgpt","tenant":"eduardo-research","version":"1"}
